{
  "name": "sap-dev",
  "version": "0.3.4",
  "description": "SAP GUI automation plugins for AI coding assistants",
  "repository": "https://github.com/sapdev-ai/sap-dev",
  "owner": {
    "name": "KexiHe",
    "email": "hello@sapdev.ai",
    "url": "https://sapdev.ai"
  },
  "metadata": {
    "version": "0.3.4",
    "last_updated": "2026-06-01",
    "total_plugins": 4,
    "total_skills": 62,
    "categories": [
      "tooling"
    ]
  },
  "plugins": [
    {
      "name": "sap-dev-core",
      "description": "Core SAP development utilities and ABAP Workbench automation. Includes login, connection management, credential storage with Windows DPAPI encryption, BDC execution via RFC, add-on table maintenance, table data query / TSV download via SE16N, transport request creation via SE01, function group creation via SE37, the check-and-fix router, object activation, ATC quality gate, package reassignment, RFC wrapper generation, structured JSONL logging and log analysis, and SAP GUI Scripting for SE01, SE21, SE38, SE37, SE24, SE11, SE16N, SE19, SE41, SE51, SE54, SE91, CMOD, and GUI recording. Keywords: SAP GUI, SAP Logon, login automation, connection management, stored credentials, DPAPI, BDC, ABAP4_CALL_TRANSACTION, RFC, add-on maintenance, transport request, function group, package, ATC, activate, RFC wrapper, log analysis, SE01, SE21, SE38, SE37, SE24, SE11, SE16N, SE19, SE41, SE51, SE54, SE91, CMOD, check and fix, table query, deploy, activate, SAP GUI Scripting",
      "source": "./plugins/sap-dev-core/",
      "skills": [
        "./skills/sap-activate-object",
        "./skills/sap-atc",
        "./skills/sap-call-bdc",
        "./skills/sap-change-package",
        "./skills/sap-check-fix",
        "./skills/sap-cmod",
        "./skills/sap-dev-clean",
        "./skills/sap-dev-init",
        "./skills/sap-dev-status",
        "./skills/sap-diagnose",
        "./skills/sap-function-group",
        "./skills/sap-gui-diagnose",
        "./skills/sap-gui-object-details",
        "./skills/sap-gui-probe",
        "./skills/sap-gui-record",
        "./skills/sap-gui-skill-scaffold",
        "./skills/sap-log-analyze",
        "./skills/sap-login",
        "./skills/sap-rfc-wrapper-class",
        "./skills/sap-rfc-wrapper-fm",
        "./skills/sap-se01",
        "./skills/sap-se11",
        "./skills/sap-se16n",
        "./skills/sap-se19",
        "./skills/sap-se21",
        "./skills/sap-se24",
        "./skills/sap-se37",
        "./skills/sap-se38",
        "./skills/sap-se41",
        "./skills/sap-se51",
        "./skills/sap-se54",
        "./skills/sap-se91",
        "./skills/sap-slg1",
        "./skills/sap-sm12",
        "./skills/sap-sm13",
        "./skills/sap-sm37",
        "./skills/sap-snro",
        "./skills/sap-sp02",
        "./skills/sap-st22",
        "./skills/sap-transport-request",
        "./skills/sap-update-addon",
        "./skills/sap-where-used-list"
      ],
      "agents": [
        "./agents/abap-developer.md"
      ],
      "version": "0.3.4",
      "category": "tooling",
      "keywords": [
        "abap-developer-agent",
        "abap-workbench",
        "activate",
        "activate-object",
        "atc",
        "automation",
        "bdc",
        "change-package",
        "cmod",
        "credentials",
        "dev-init",
        "deploy",
        "dpapi",
        "function-group",
        "gui-object-details",
        "gui-probe",
        "gui-scripting",
        "gui-skill-scaffold",
        "log-analyze",
        "login",
        "rfc",
        "rfc-wrapper-class",
        "rfc-wrapper-fm",
        "sap",
        "scripting",
        "se01",
        "se11",
        "se16n",
        "se19",
        "se21",
        "se24",
        "se37",
        "se37-fugr",
        "se38",
        "se41",
        "se51",
        "se54",
        "se91",
        "snro",
        "transport-request",
        "vbscript"
      ],
      "license": "GPL-3.0"
    },
    {
      "name": "sap-gen-code",
      "description": "ABAP code generation and validation. /sap-docs-layout customizes the spec template's structural layout via a self-describing (Meta) Layout sheet; /sap-docs-extract reads Excel/Word/PDF specs and produces structured artefacts; /sap-docs-convert applies customer-specific normalisation rules (field/type/flag remap, schema migration); /sap-gen-abap produces ABAP source per Customer Brief profile; /sap-check-abap and /sap-check-fm validate naming, types, SQL fields, and CALL FUNCTION parameters via live RFC; /sap-fix-abap and /sap-fix-fm auto-patch detected issues. Keywords: ABAP code generation, design document, spec template layout, naming conventions, type check, SQL validation, FM parameter check, auto-fix, spec conversion, rules-driven normalisation",
      "source": "./plugins/sap-gen-code/",
      "skills": [
        "./skills/sap-check-abap",
        "./skills/sap-check-fm",
        "./skills/sap-docs-check-ddic",
        "./skills/sap-docs-check-process",
        "./skills/sap-docs-convert",
        "./skills/sap-docs-extract",
        "./skills/sap-docs-layout",
        "./skills/sap-fix-abap",
        "./skills/sap-fix-fm",
        "./skills/sap-gen-abap"
      ],
      "version": "0.3.4",
      "category": "tooling",
      "keywords": [
        "abap",
        "auto-fix",
        "code-generation",
        "code-quality",
        "design-document",
        "fm-validation",
        "naming-conventions",
        "sap",
        "spec-template",
        "spec-layout",
        "sql-validation",
        "type-check",
        "validation"
      ],
      "license": "GPL-3.0"
    },
    {
      "name": "sap-tcd",
      "description": "SAP transaction automation for business processes. Manages Business Partners via BP, Material Masters via MM01/MM02/MM03, and Sales Orders via VA01/VA02/VA03 with create/update/check operations. Keywords: Business Partner, Material Master, Sales Order, BP, MM01, VA01, transaction automation",
      "source": "./plugins/sap-tcd",
      "skills": [
        "./skills/sap-bp",
        "./skills/sap-mm01",
        "./skills/sap-va01"
      ],
      "version": "0.3.4",
      "category": "tooling",
      "keywords": [
        "bp",
        "business-partner",
        "material-master",
        "mm01",
        "sales-order",
        "sap",
        "transaction",
        "va01",
        "vbscript"
      ],
      "license": "GPL-3.0"
    },
    {
      "name": "sap-migrate",
      "description": "S/4HANA custom-code migration engine. Runs a brownfield custom-code conversion as a tracked campaign: /sap-cc-campaign owns the campaign workspace, state ledger, dashboard, and next-step orchestration; downstream skills inventory custom (Z/Y) objects, flag unused code for decommission from usage data, run the S/4HANA-readiness ATC, triage findings into remediation tiers, and auto-remediate mechanical changes on a sandbox. Companion to sap-dev-core (install that first). Keywords: S/4HANA migration, custom code migration, brownfield conversion, ATC S4HANA_READINESS, simplification database, decommission, SPDD, SPAU, remediation campaign",
      "source": "./plugins/sap-migrate/",
      "skills": [
        "./skills/sap-cc-campaign",
        "./skills/sap-cc-inventory",
        "./skills/sap-cc-usage",
        "./skills/sap-cc-analyze",
        "./skills/sap-cc-triage",
        "./skills/sap-cc-remediate",
        "./skills/sap-cc-learn"
      ],
      "agents": [
        "./agents/cc-migration-engineer.md"
      ],
      "version": "0.3.4",
      "category": "tooling",
      "keywords": [
        "abap",
        "atc",
        "brownfield",
        "ccm",
        "conversion",
        "custom-code",
        "decommission",
        "migration",
        "remediation",
        "s4hana",
        "sap",
        "scope"
      ],
      "license": "GPL-3.0"
    }
  ]
}
